{
  "$schema": "https://json-schema.org/draft/2020-12/schema",
  "$id": "https://kaiak.invalid/protocol/schema/status.schema.json",
  "title": "kaiak gateway status",
  "description": "The body of POST /v1/status (docs/specs/CONTROL-PROTOCOL.md, Gateway status).",
  "type": "object",
  "additionalProperties": false,
  "required": [
    "instance",
    "protocol_version",
    "state",
    "started_at",
    "applied_config_hash",
    "last_rejection",
    "backends",
    "models"
  ],
  "properties": {
    "instance": {
      "$ref": "common.schema.json#/$defs/instance"
    },
    "protocol_version": {
      "description": "The protocol version the gateway speaks.",
      "const": 6
    },
    "state": {
      "enum": [
        "ready",
        "draining"
      ]
    },
    "started_at": {
      "description": "When the gateway process started.",
      "$ref": "config.schema.json#/$defs/timestamp"
    },
    "applied_config_hash": {
      "description": "The config_hash of the config in force; null before the first config from the control plane is applied, and while the seed config is in force.",
      "anyOf": [
        {
          "type": "null"
        },
        {
          "$ref": "common.schema.json#/$defs/config_hash"
        }
      ]
    },
    "last_rejection": {
      "description": "The latest config received from the control plane, when the gateway rejected it; null once a later config is applied, and before any rejection.",
      "anyOf": [
        {
          "type": "null"
        },
        {
          "type": "object",
          "additionalProperties": false,
          "required": [
            "config_hash",
            "codes"
          ],
          "properties": {
            "config_hash": {
              "$ref": "common.schema.json#/$defs/config_hash"
            },
            "codes": {
              "description": "The rejection's issue codes: syntax, schema, a semantic rule code, or a gateway-only code.",
              "type": "array",
              "minItems": 1,
              "uniqueItems": true,
              "items": {
                "type": "string",
                "pattern": "^[a-z][a-z0-9-]*$"
              }
            }
          }
        }
      ]
    },
    "backends": {
      "description": "Every backend of the applied config, and any other backend with requests still in flight (dropped by a reload); empty before the first config is applied.",
      "type": "object",
      "propertyNames": {
        "$ref": "config.schema.json#/$defs/id"
      },
      "additionalProperties": {
        "type": "object",
        "additionalProperties": false,
        "required": [
          "in_flight",
          "deployments"
        ],
        "properties": {
          "in_flight": {
            "description": "Requests in flight on the backend.",
            "$ref": "common.schema.json#/$defs/count"
          },
          "max_in_flight": {
            "description": "The backend's cap from the applied config, as configured (the fleet-wide cap, not this gateway's share); absent = no cap.",
            "type": "integer",
            "minimum": 1,
            "maximum": 9007199254740991
          },
          "deployments": {
            "description": "The circuit of each of the applied config's deployments on this backend, keyed by the model name on the backend.",
            "type": "object",
            "propertyNames": {
              "$ref": "config.schema.json#/$defs/backend_model_name"
            },
            "additionalProperties": {
              "$ref": "#/$defs/deployment"
            }
          }
        }
      }
    },
    "models": {
      "description": "Every model of the applied config; empty before the first config is applied.",
      "type": "object",
      "propertyNames": {
        "$ref": "config.schema.json#/$defs/public_model_name"
      },
      "additionalProperties": {
        "type": "object",
        "additionalProperties": false,
        "required": [
          "queued"
        ],
        "properties": {
          "queued": {
            "description": "Requests waiting in the model's queue.",
            "$ref": "common.schema.json#/$defs/count"
          }
        }
      }
    }
  },
  "$defs": {
    "deployment": {
      "type": "object",
      "additionalProperties": false,
      "required": [
        "circuit"
      ],
      "properties": {
        "circuit": {
          "description": "closed: serving. open: out of rotation, waiting for a probe. half_open: a probe succeeded; the next request is the trial that closes or re-opens it.",
          "enum": [
            "closed",
            "open",
            "half_open"
          ]
        },
        "opened_at": {
          "description": "When the circuit opened; present exactly when it is open or half-open (a half-open circuit keeps its opening time).",
          "$ref": "config.schema.json#/$defs/timestamp"
        }
      },
      "if": {
        "properties": {
          "circuit": {
            "enum": [
              "open",
              "half_open"
            ]
          }
        },
        "required": [
          "circuit"
        ]
      },
      "then": {
        "required": [
          "opened_at"
        ]
      },
      "else": {
        "not": {
          "required": [
            "opened_at"
          ]
        }
      }
    }
  }
}
