{
  "instance": "gw-1",
  "protocol_version": 6,
  "state": "ready",
  "started_at": "2026-09-24T09:58:12.5Z",
  "applied_config_hash": "9f2c8a1e4b7d6c3f0a5e8b2d1c4f7a9e6b3d0c8f5a2e7b4d1c9f6a3e0b8d5c2f",
  "last_rejection": null,
  "backends": {
    "vllm-a": {
      "in_flight": 3,
      "max_in_flight": 4,
      "deployments": {
        "Qwen/Qwen3-32B": {
          "circuit": "closed"
        }
      }
    },
    "vllm-b": {
      "in_flight": 0,
      "deployments": {
        "Qwen/Qwen3-32B": {
          "circuit": "open",
          "opened_at": "2026-09-24T10:01:02.25Z"
        },
        "BAAI/bge-m3": {
          "circuit": "closed"
        }
      }
    },
    "azure-westeurope": {
      "in_flight": 1,
      "deployments": {
        "gpt-4.1-prod": {
          "circuit": "closed"
        }
      }
    },
    "llama-embed": {
      "in_flight": 0,
      "max_in_flight": 9007199254740991,
      "deployments": {
        "/models/qwen3-embedding-0.6b-q8_0.gguf": {
          "circuit": "half_open",
          "opened_at": "2026-09-24T09:59:40Z"
        }
      }
    }
  },
  "models": {
    "qwen3-32b": {
      "queued": 2
    },
    "gpt-4.1": {
      "queued": 0
    },
    "bge-m3": {
      "queued": 0
    },
    "qwen3-embedding": {
      "queued": 0
    }
  }
}
